6731902,01/13/2022,01/13/2022,CN140016,OPEN,,DWELLING CLEAN AND SANITARY,INTERIOR:009 :INTERIOR,APT. 902 - KITCHEN CABINET UNDER SINK - CABINET ROTTING WITH BLACK SUBSTANCE.,"Keep premises clean, sanitary, and safe. (13-196-620 A, 13-196-630)",365764,13644929,FAILED,N,COMPLAINT,CONSERVATION,5858 N SHERIDAN RD,5858,N,SHERIDAN,RD,12441,,41.989005653,-87.655499992,"(41.98900565310205, -87.65549999168219)",2022,01,13
6732331,01/14/2022,01/14/2022,CN138106,OPEN,,STOP/REMOVE NUISANCE,OTHER   :    :OTHER,FRONT AND REAR YARDS - LARGE PILES OF JUNK ACCUMULATION.,Remove and stop nuisance. (7-28-060),BL00831,13645121,FAILED,N,COMPLAINT,CONSERVATION,5205 S ABERDEEN ST,5205,S,ABERDEEN,ST,330171,,41.799446271,-87.652435257,"(41.79944627067239, -87.6524352572086)",2022,01,14
6732317,01/14/2022,01/14/2022,PL151137,OPEN,,OPEN,,,,BL00896,13645110,PASSED,N,PERMIT,PLUMBING,6620 S CLAREMONT AVE,6620,S,CLAREMONT,AVE,382546,,41.773131934,-87.682265891,"(41.773131933540576, -87.68226589089839)",2022,01,14
6732394,01/14/2022,01/14/2022,EV1110,OPEN,,MAINTAIN OR REPAIR ELECT ELEVA,,PROVIDE ROPE GUARDS ON MACHINE,"Failed to maintain electric elevator equipment provided at premises in safe and sound working condition. (13-196-590, 13-196-630(b), 18-30-001)",425425,13571564,FAILED,N,PERMIT,ELEVATOR,100 S LA SALLE ST,100,S,LA SALLE,ST,14796,,41.880611687,-87.632473574,"(41.88061168740763, -87.63247357435637)",2022,01,14
6731747,01/14/2022,01/14/2022,CN063024,OPEN,,CHIMNEY CAPPING,EXTERIOR:E   :,CHIMNEYS - MISSING CAPS,"Cap masonry chimney with non-combustible, water proof materials. (13-152-250 B, 13-152-240, 13-196-590)",BL00904,13644813,FAILED,N,COMPLAINT,CONSERVATION,3310 W MONROE ST,3310,W,MONROE,ST,25507,,41.879727295,-87.708954216,"(41.87972729468691, -87.70895421586162)",2022,01,14
6731748,01/14/2022,01/14/2022,CN063014,OPEN,,CHIMNEY,EXTERIOR:SE  :,"CHIMNEY - FRACTURES ,LOOSE MORTAR","Failed to maintain chimney in safe and sound working condition.  (13-196-590, 13-196-530(b) and (c), 13-196-641)",BL00904,13644813,FAILED,N,COMPLAINT,CONSERVATION,3310 W MONROE ST,3310,W,MONROE,ST,25507,,41.879727295,-87.708954216,"(41.87972729468691, -87.70895421586162)",2022,01,14
6731829,01/13/2022,01/13/2022,CN135016,OPEN,,MICE/RODENTS,OTHER   :    :OTHER,"BUILDING INFESTED WITH MICE, INCLUDING 2ND FLOOR APT.","Exterminate rodents in building and seal openings through which they gain access. (13-196-530 D, 13-196-630 C, 7-28-660)",87296,13644845,FAILED,N,COMPLAINT,CONSERVATION,7818 S SANGAMON ST,7818,S,SANGAMON,ST,423589,32.0,41.751805649,-87.64786015,"(41.75180564935499, -87.647860149772)",2022,01,13
6732405,01/14/2022,01/14/2022,EV1110,OPEN,,MAINTAIN OR REPAIR ELECT ELEVA,,PROVIDE MACHINE ROOM DOOR SIGNAGE,"Failed to maintain electric elevator equipment provided at premises in safe and sound working condition. (13-196-590, 13-196-630(b), 18-30-001)",425425,13571564,FAILED,N,PERMIT,ELEVATOR,100 S LA SALLE ST,100,S,LA SALLE,ST,14796,,41.880611687,-87.632473574,"(41.88061168740763, -87.63247357435637)",2022,01,14
6732241,01/14/2022,01/14/2022,CN138106,OPEN,,STOP/REMOVE NUISANCE,OTHER   :    :OTHER,REAR YARD -SEVERE DOG FOULING AND ABANDONED VEHICLE.,Remove and stop nuisance. (7-28-060),BL00831,13645044,FAILED,N,COMPLAINT,CONSERVATION,6544 S WOLCOTT AVE,6544,S,WOLCOTT,AVE,381855,,41.774405296,-87.671510363,"(41.774405295559575, -87.67151036288253)",2022,01,14
6732429,01/14/2022,01/14/2022,CN076034,OPEN,,REPAIR GUTTER,OTHER   :    :OTHER,REAR ELEVATION-BOX GUTTERS-CLOGGED WITH TREE BRAANCHES AND LEAVES.,"Failed to maintain roof gutters in good repair and working condition.  (13-196-590, 13-196-630(b), 13-196-641, 18-29-1101, 18-29-1105, 18-29-1106)",BL00708,13645160,FAILED,N,COMPLAINT,CONSERVATION,1900 W GREENLEAF AVE,1900,W,GREENLEAF,AVE,13771,,42.01024091,-87.678210197,"(42.01024091030554, -87.67821019715844)",2022,01,14
6731738,01/14/2022,01/14/2022,CN070014,OPEN,,REPAIR EXTERIOR STAIR,EXTERIOR:NW  :,FRONT BASEMENT STAIRS- MISSING HANDRAIL,"Failed to maintain exterior stairways in safe condition and in sound repair.  (13-196-570, 13-196-641)",BL00904,13644810,FAILED,N,COMPLAINT,CONSERVATION,4410 W MONROE ST,4410,W,MONROE,ST,250824,,41.8797486,-87.735948025,"(41.87974860003691, -87.73594802521563)",2022,01,14
6732016,01/14/2022,01/14/2022,CN066034,OPEN,,REPAIR BALCONY,OTHER   :    :OTHER,"EAST BALCONY, GUARDRAILS END POSTS TO WALL ARE FASTENED WITH NAILS ONLY, HORIZONTAL TIES ARE FASTENED WITH NAILS ONLY.","Failed to maintain balcony in good repair and free from cracks and defects.  (13-196-530(e), 13-196-641)",BL00831,13644986,FAILED,N,COMPLAINT,CONSERVATION,1148 W 72ND ST,1148,W,72ND,ST,562428,,41.763354158,-87.653591648,"(41.7633541583016, -87.6535916481938)",2022,01,14
6732330,01/14/2022,01/14/2022,CN076014,OPEN,,PROVIDE GUTTER & DOWNSPOUT,OTHER   :    :OTHER,NORTH AND SOUTH ELEVATIONS - MISSING GUTTERS AND DOWNSPOUTS.,Install and connect roof gutter and downspout to sanitary sewer. (13-168-600),BL00831,13645121,FAILED,N,COMPLAINT,CONSERVATION,5205 S ABERDEEN ST,5205,S,ABERDEEN,ST,330171,,41.799446271,-87.652435257,"(41.79944627067239, -87.6524352572086)",2022,01,14
6731903,01/13/2022,01/13/2022,CN031023,OPEN,,FIRE EXTNGSHR RECHARGE & TAG,"OTHER   :    :INTERIOR,",STAIRWELLS AND LOBBY - FIRE EXTINGUISHER RECHARGE TAGS EXPIRED 2020.,Failed to maintain properly charged fire extinguisher and to attach tag which clearly indicates recharge date and signature of the person who performed the recharge.  (15-16-680),365764,13644929,FAILED,N,COMPLAINT,CONSERVATION,5858 N SHERIDAN RD,5858,N,SHERIDAN,RD,12441,,41.989005653,-87.655499992,"(41.98900565310205, -87.65549999168219)",2022,01,13
6731965,01/13/2022,01/13/2022,CN197079,OPEN,,REPAIR/REPLACE SMOKE DETECTORS,OTHER   :    :OTHER,"THE 1ST FLOOR APARTMENT DOES NOT HAVE A FUNCTIONING SMOKE DETECTOR. ALSO, THE REAR INTERIOR SMOKE DETECTOR IS DEFECTIVE.SECTION 14X-5-504.8","Repair or replace defective or out of service smoke detectors and operate continuously. (13-196-130, 13-196-140)",BL00685,13644968,FAILED,N,COMPLAINT,CONSERVATION,2315 N MEADE AVE,2315,N,MEADE,AVE,96071,,41.922458791,-87.777956814,"(41.92245879078645, -87.77795681447155)",2022,01,13
6732400,01/14/2022,01/14/2022,EV1110,OPEN,,MAINTAIN OR REPAIR ELECT ELEVA,,PROVIDE COUNTERWEIGHT RUNBY SIGN AND FILL-IN DATA,"Failed to maintain electric elevator equipment provided at premises in safe and sound working condition. (13-196-590, 13-196-630(b), 18-30-001)",425425,13571564,FAILED,N,PERMIT,ELEVATOR,100 S LA SALLE ST,100,S,LA SALLE,ST,14796,,41.880611687,-87.632473574,"(41.88061168740763, -87.63247357435637)",2022,01,14
6731971,01/13/2022,01/13/2022,EL0018,OPEN,,DEFECTIVE OUTLETS,OTHER   :    :OTHER,THE 1ST FLOOR APARTMENT HAS NUMEROUS DEFECTIVE SWITCHES AND OUTLETS.SECTION 14X-7-701,"Replace broken, inoperable, or painted over receptacle or switch. (18-27-200.1, 18-27-200.10(b))",BL00685,13644968,FAILED,N,COMPLAINT,CONSERVATION,2315 N MEADE AVE,2315,N,MEADE,AVE,96071,,41.922458791,-87.777956814,"(41.92245879078645, -87.77795681447155)",2022,01,13
6731913,01/13/2022,01/13/2022,CN046013,OPEN,,UNAPPROVED HEATING DEVICE,"OTHER   :    :INTERIOR,",APT. 2A - USING COOKING APPLIANCE AS HEATING DEVICE. DANGEROUS AND HAZARDOUS.,Stop using cooking or water heating device as heating device. (13-196-400),365764,13644932,FAILED,N,COMPLAINT,CONSERVATION,1554 W JONQUIL TER,1554,W,JONQUIL,TER,24587,,42.021261678,-87.67049632,"(42.021261678150104, -87.67049631976245)",2022,01,13
6732004,01/13/2022,01/13/2022,CN104075,OPEN,,WINDOW REPAIR FOR AIR SEEPAGE,INTERIOR:002 :,"3907 W./ 2ND FLOOR / FRONT DOORS  GAPS, DRAFTY DOOR, AIR SEEPAGE. (14X-3-303.13 AND 14X-12-1202.4.3.3)",Failed to maintain windows in relation to the adjacent wall construction as to completely exclude rain and substantially exclude wind from entering the premises.  (13-196-550(f)),447020,13644979,FAILED,N,COMPLAINT,CONSERVATION,3907 W VAN BUREN ST,3907,W,VAN BUREN,ST,249070,,41.875184915,-87.723386871,"(41.87518491500516, -87.72338687087769)",2022,01,13
6731959,01/13/2022,01/13/2022,CN070034,OPEN,,REPLACE D&H PORCH,OTHER   :    :OTHER,"THE 3 STORY REAR PORCH IS IN DANGEROUS AND HAZARDOUS CONDITION. *THE CONCRETE STRUCTURAL FOOTING ARE CRACKED / FRACTURED. *ALL OF THE STRUCTURAL BRACKETS AND THEIR HARDWARE ARE SEVERELY RUSTED. *ALL OF THE NAILED JOINTS (DECKING, BANISTERS, STAIR TREADS, STAIR STRIGERS) HAVE SEVERELY RUSTED NAILS. *ALL OF THE STRUCTURAL JOIST HANGERS ARE SEVERELY RUSTED. *THERE ARE NUMEROUS LOOSE STAIR TREADS, DECK BOARDS AND AREAS OF LOOSE BANISTERS. *THERE ARE NUMEROUS MISSING BANISTER PICKETTS. *THE STAIR FLIGHT FROM THE 1ST TO 2CD FLOOR IS PARTIALLY COLLAPSED AND MAKES REAR EGRESS FOR THE 2CD / 3RD FLOORS (4 APARTMENTS) IMPOSSIBLE.*THERE ARE MISSING / FRACTURED RISER BOARDS. *THERE ARE MULTIP;LE FRACTURED / LOOSE STAIR TREADS.THIS PORCH IS IN AN EXTREME STATE OF DISREPAIR AND NEEDS TO BE REPLACED. PLANS / PERMIT ARE REQUIRED.SECTION 14X-3-303.1.1","Failed to rebuild or replace dilapidated and dangerous porch.  (13-196-570, 13-196-641)",BL00685,13644966,FAILED,N,COMPLAINT,CONSERVATION,4528 N MAGNOLIA AVE,4528,N,MAGNOLIA,AVE,173712,34.0,41.96440479,-87.66114967,"(41.964404790039836, -87.66114966955033)",2022,01,13
6731912,01/13/2022,01/13/2022,CN132046,OPEN,,SAFE WORKING CONDITIONS,"OTHER   :    :INTERIOR,","APT. 2A - BEDROOM RADIATOR AT WALL BASE. EQUIPMENT NOT MAINTAINED IN GOOD REPAIR OR STRUCTURALLY SOUND. RADIATOR MISSING PROTECTIVE COVER, RATIATOR FINS ARE BENT AND BROKEN. (14X-3-305.1, 14X-8-804.1 THRU 14X-8-804.4 AND 14X-8-804.5)","Provide and maintain every facility, piece of equipment, or utility in safe and sound working condition. (13-196-400, 13-196-440)",365764,13644932,FAILED,N,COMPLAINT,CONSERVATION,1554 W JONQUIL TER,1554,W,JONQUIL,TER,24587,,42.021261678,-87.67049632,"(42.021261678150104, -87.67049631976245)",2022,01,13
6731972,01/13/2022,01/13/2022,CN104035,OPEN,,MAINTAIN WINDOW,OTHER   :    :OTHER,THERE IS WATER LEAKING INTO THE BEDROOM OF THE 1ST FLOOR UNIT FROM THE AREA AROUND WHERE A WINDOWS IS SET INTO THE EXTERIOR BRICK WALL.SECTION 14X-3-303.13,Failed to maintain windows in sound condition and good repair.  (13-196-550(b) and (f)),BL00685,13644968,FAILED,N,COMPLAINT,CONSERVATION,2315 N MEADE AVE,2315,N,MEADE,AVE,96071,,41.922458791,-87.777956814,"(41.92245879078645, -87.77795681447155)",2022,01,13
6732345,04/25/2023,01/14/2022,EV1110,COMPLIED,04/21/2023,MAINTAIN OR REPAIR ELECT ELEVA,,INSTALL CWT. TIE DOWNS.,"Failed to maintain electric elevator equipment provided at premises in safe and sound working condition. (13-196-590, 13-196-630(b), 18-30-001)",312525,13645129,PASSED,N,PERMIT,ELEVATOR,500 S CLINTON ST,500,S,CLINTON,ST,14964,,41.875249232,-87.641126207,"(41.875249231595554, -87.64112620692853)",2022,01,14
6731811,07/14/2023,01/13/2022,CN061014,COMPLIED,07/14/2023,REPAIR EXTERIOR WALL,OTHER   :    :OTHER,SOUTH AND WEST ELEVATIONS - WASHED OUT MORTAR AND SPALLING BRICKS.,"Failed to maintain the exterior walls of a building or structure free from holes, breaks, loose or rotting boards or timbers and any other conditions which might admit rain or dampness to the walls.  (13-196-530(b), 13-196-641)",87296,14114720,FAILED,N,COMPLAINT,CONSERVATION,403 W 103RD ST,403,W,103RD,ST,24594,,41.706930367,-87.633352654,"(41.70693036655445, -87.6333526539513)",2022,01,13
6731830,01/13/2022,01/13/2022,CN103015,OPEN,,REPAIR FLOOR,OTHER   :    :OTHER,"2ND FLOOR APT, LIVING ROOM HARDWOOD FLOOR - BROKEN BOARD.","Failed to maintain floor free from holes and wide cracks and free from loose, warped, protruding or rotting floor boards.  (13-196-540(a) and (b))",87296,13644845,FAILED,N,COMPLAINT,CONSERVATION,7818 S SANGAMON ST,7818,S,SANGAMON,ST,423589,32.0,41.751805649,-87.64786015,"(41.75180564935499, -87.647860149772)",2022,01,13
6732438,02/09/2022,01/14/2022,EV1110,COMPLIED,02/08/2022,MAINTAIN OR REPAIR ELECT ELEVA,,EMERGENCY PHONE ISN'T WORKING. CAR 1,"Failed to maintain electric elevator equipment provided at premises in safe and sound working condition. (13-196-590, 13-196-630(b), 18-30-001)",312525,13645173,FAILED,N,COMPLAINT,ELEVATOR,615 S WABASH AVE,615,S,WABASH,AVE,661632,,41.874067734,-87.625841633,"(41.87406773378864, -87.62584163294382)",2022,01,14
6731739,01/14/2022,01/14/2022,CN079023,OPEN,,GARAGE: DANGER S&S TEAR DOWN,EXTERIOR:N   :,"REAR GARAGE - ROTTES EAVES AND OVERHEAD DOOR WOOD PANELS, MISSING SERVICE DOOR, FIRE DAMAGED SIDING PANELS, COLLAPSING ROOF, JUNK AND DEBRIS INSIDE OF GARAGE,PERMIT IS  REQUIRED TO DEMOLISH GARAGE, PLANS AND PERMIT ARE REQUIRED TO REPLACE GARAGE.. ALL WORK IS SUBJECT TO FIELD INSPECTION AND APPROVAL BY NEW CONSTRUCTION AND ELECTRICAL BUREAUS.(PER SECTIONS 14A-3-302, 14A-3-313, 14A-3-13-313.4) PLEASE CALL BUILDING DEPT. TO DISCUSS AT 312/743-3512 OR 312/743-3517 BETWEEN 10AM & 12NOON.","Pursuant to Chicago Municipal Code Section 13-9-020, the property referenced above has a garage that is deemed to be a public safety threat.  In the event the owner of the garage fails to correct the conditions creating the public safety threat or fails to seek a hearing within three days, excluding Saturdays, Sundays and legal holidays, or as otherwise provided in subsection (C)(2) of Section 13-9-020, the Commissioner of Streets and Sanitation or his designee may provide for the immediate demolition of the garage.",BL00904,13644810,FAILED,N,COMPLAINT,CONSERVATION,4410 W MONROE ST,4410,W,MONROE,ST,250824,,41.8797486,-87.735948025,"(41.87974860003691, -87.73594802521563)",2022,01,14
6732305,01/14/2022,01/14/2022,CN067014,OPEN,,REPAIR ROOF,OTHER   :    :OTHER,ROOF DETERIORATED SHINGLES.,"Failed to maintain roof in sound condition and repair, watertight and free from defects.  (13-196-530, 13-196-530(c) and 13-196-641)",BL00831,13645102,FAILED,N,COMPLAINT,CONSERVATION,5043 S PAULINA ST,5043,S,PAULINA,ST,322216,,41.80184112,-87.6670794,"(41.801841120078386, -87.66707939990428)",2022,01,14
6731816,07/03/2023,01/13/2022,CN070014,OPEN,,REPAIR EXTERIOR STAIR,OTHER   :    :OTHER,"SOUTH EXTERIOR STAIRS GRADE TO BASEMENT - ERODED AND CRACKED CONCRETE.; GRADE TO 1ST - SPLIT TREADS; TRADS ONLY 9-1/2""; STRINGERS FASTENED WITH WOOD SCREWS ONLY, EAST BANISTERS ARE ONLY 35"" HIGH.","Failed to maintain exterior stairways in safe condition and in sound repair.  (13-196-570, 13-196-641)",87296,14114720,FAILED,N,COMPLAINT,CONSERVATION,403 W 103RD ST,403,W,103RD,ST,24594,,41.706930367,-87.633352654,"(41.70693036655445, -87.6333526539513)",2022,01,13
6732015,01/14/2022,01/14/2022,CN065014,OPEN,,REPAIR LINTELS,OTHER   :    :OTHER,SOUTH ELEVATION LINTELS ARE BENT AAND PACKED WITH MORTAR. MASONRY PERMIT REQUIRED TO REPLACE LINTELS.,"Failed to maintain lintel in good repair and free from cracks and defects.  (13-196-530(e), 13-196-641)",BL00831,13644986,FAILED,N,COMPLAINT,CONSERVATION,1148 W 72ND ST,1148,W,72ND,ST,562428,,41.763354158,-87.653591648,"(41.7633541583016, -87.6535916481938)",2022,01,14
6732020,01/14/2022,01/14/2022,PL160017,OPEN,,REMV OBSTR FROM DRAINAGE SYSTM,OTHER   :    :OTHER,"2E, TOILET IS OUT SERVICE AND COVERED WITH PLASTIC.","Remove obstruction from plumbing and drainage system. (13-168-120),  (18-29-102.3)",BL00831,13644986,FAILED,N,COMPLAINT,CONSERVATION,1148 W 72ND ST,1148,W,72ND,ST,562428,,41.763354158,-87.653591648,"(41.7633541583016, -87.6535916481938)",2022,01,14
6732334,01/14/2022,01/14/2022,CN190019,OPEN,,ARRANGE PREMISE INSPECTION,OTHER   :    :OTHER,"INTERIOR OF S.F.R. - NO RESPONSE, UNABLE TO VERIFY DETECTORS AND INTERIOR CONDITIONS.",Arrange for inspection of premises. (13-12-100),BL00831,13645121,FAILED,N,COMPLAINT,CONSERVATION,5205 S ABERDEEN ST,5205,S,ABERDEEN,ST,330171,,41.799446271,-87.652435257,"(41.79944627067239, -87.6524352572086)",2022,01,14
6732428,01/14/2022,01/14/2022,CN104015,OPEN,,"REPLCE WINDOW PANES, PLEXGLAS",OTHER   :    :OTHER,REAR ELEVATION AT ALLEY- BROKEN PANE.,"Replace broken, missing or defective window panes. (13-196-550 A)",BL00708,13645160,FAILED,N,COMPLAINT,CONSERVATION,1900 W GREENLEAF AVE,1900,W,GREENLEAF,AVE,13771,,42.01024091,-87.678210197,"(42.01024091030554, -87.67821019715844)",2022,01,14
6732370,01/14/2022,01/14/2022,EV1110,OPEN,,MAINTAIN OR REPAIR ELECT ELEVA,,PROVIDE ROPE DATA TAGS FOR NEW GOVERNOR AND CAR CABLES,"Failed to maintain electric elevator equipment provided at premises in safe and sound working condition. (13-196-590, 13-196-630(b), 18-30-001)",425425,13571564,FAILED,N,PERMIT,ELEVATOR,100 S LA SALLE ST,100,S,LA SALLE,ST,14796,,41.880611687,-87.632473574,"(41.88061168740763, -87.63247357435637)",2022,01,14
6732309,01/14/2022,01/14/2022,CN190019,OPEN,,ARRANGE PREMISE INSPECTION,OTHER   :    :OTHER,"INTERIOR OF BUILDING - GATE LOCKED, UNABLE TO VERIFY DETECTORS AND INTERIOR CONDITIONS.",Arrange for inspection of premises. (13-12-100),BL00831,13645102,FAILED,N,COMPLAINT,CONSERVATION,5043 S PAULINA ST,5043,S,PAULINA,ST,322216,,41.80184112,-87.6670794,"(41.801841120078386, -87.66707939990428)",2022,01,14
6732240,01/14/2022,01/14/2022,CN061014,OPEN,,REPAIR EXTERIOR WALL,OTHER   :    :OTHER,NORTH AND SOUTH ELEVATIONS - WASHED OUT MORTAR AND SPALLING BRICKS.,"Failed to maintain the exterior walls of a building or structure free from holes, breaks, loose or rotting boards or timbers and any other conditions which might admit rain or dampness to the walls.  (13-196-530(b), 13-196-641)",BL00831,13645044,FAILED,N,COMPLAINT,CONSERVATION,6544 S WOLCOTT AVE,6544,S,WOLCOTT,AVE,381855,,41.774405296,-87.671510363,"(41.774405295559575, -87.67151036288253)",2022,01,14
6732128,01/10/2022,01/10/2022,CN070024,OPEN,,REPAIR PORCH SYSTEM,EXTERIOR:E   :EXTERIOR,"EAST AND SOUTH ELEVATIONS - 2 STORY OPEN WOOD PORCH SYSTEM , 2ND FLOOR LANDING SUPPORTED ON ROOF OF EXISTING ENCLOSED SINGLE STORY PORCH, DECK BEARING CONNECTIONS UNKNOW. DECK BOARDS AND STAIR TREADS ROTTING AND WEAK. RIM JOIST SCABBED WITH PULLING TOENAILED CONNECTIONS TO BEAMS. STRINGERS AT NOT PROPERTLY SUPPORTED AT BOTH BASE AND HEADS. DANGEROUS AND HAZARDOUS.","Failed to repair or replace defective or missing members of porch system.  (13-196-570, 13-196-641)",BL01037,13645002,FAILED,N,COMPLAINT,CONSERVATION,2723 N ARTESIAN AVE,2723,N,ARTESIAN,AVE,100993,,41.931053619,-87.688941992,"(41.931053619085496, -87.68894199204902)",2022,01,10
6731964,01/13/2022,01/13/2022,CN140016,OPEN,,DWELLING CLEAN AND SANITARY,OTHER   :    :OTHER,"THE 1ST FLOOR APARTMENT IS ABSOLUTELY FILTHY. THERE IS NO ONGOING CLEANING OF ANY SORT. THE WALLS, FLOORS AND CEILINGS ARE COVERED WITH DIRT AND GRIME. EXTREMELY UNSANITARY CONDITION.14X-1-103.5.1","Keep premises clean, sanitary, and safe. (13-196-620 A, 13-196-630)",BL00685,13644968,FAILED,N,COMPLAINT,CONSERVATION,2315 N MEADE AVE,2315,N,MEADE,AVE,96071,,41.922458791,-87.777956814,"(41.92245879078645, -87.77795681447155)",2022,01,13
6732019,01/14/2022,01/14/2022,CN197049,OPEN,,INSTALL EXTRA SMOKE DETECTORS,OTHER   :    :OTHER,APT 2E - MISSING REAR SMOKE DETECTOR.,Install additional approved smoke detectors. (13-196-110),BL00831,13644986,FAILED,N,COMPLAINT,CONSERVATION,1148 W 72ND ST,1148,W,72ND,ST,562428,,41.763354158,-87.653591648,"(41.7633541583016, -87.6535916481938)",2022,01,14
6732393,01/14/2022,01/14/2022,EV1110,OPEN,,MAINTAIN OR REPAIR ELECT ELEVA,,PROVIDE TACTILE LANDING DESIGNATIONS ON BOTH JAMBS AND ELEVATOR IDENTIFICATION AT EVERY LANDING,"Failed to maintain electric elevator equipment provided at premises in safe and sound working condition. (13-196-590, 13-196-630(b), 18-30-001)",425425,13571564,FAILED,N,PERMIT,ELEVATOR,100 S LA SALLE ST,100,S,LA SALLE,ST,14796,,41.880611687,-87.632473574,"(41.88061168740763, -87.63247357435637)",2022,01,14
6731833,01/13/2022,01/13/2022,CN070024,OPEN,,REPAIR PORCH SYSTEM,OTHER   :    :OTHER,FRONT MASONRY PORCH - WASHED OUUT MORTAR; SOUTH LINTEL IS BENT - MASONRY PERMIT REQUIRED TO REPAIR FRONT PORCH.,"Failed to repair or replace defective or missing members of porch system.  (13-196-570, 13-196-641)",87296,13644845,FAILED,N,COMPLAINT,CONSERVATION,7818 S SANGAMON ST,7818,S,SANGAMON,ST,423589,32.0,41.751805649,-87.64786015,"(41.75180564935499, -87.647860149772)",2022,01,13
6732295,01/14/2022,01/14/2022,RF301051,OPEN,,ARRANGE FOR RE-INSPECTION,INSPECTION,INSPECTION,"Arrange for refrigeration/air conditioning reinspection. (13-192-760, 13-12-100)",BL00912,12929793,FAILED,N,PERMIT,REFRIGERATION,2404 W MOFFAT ST,2404,W,MOFFAT,ST,673443,33.0,41.914963063,-87.687615257,"(41.91496306254334, -87.6876152566363)",2022,01,14
6732244,01/14/2022,01/14/2022,CN190019,OPEN,,ARRANGE PREMISE INSPECTION,OTHER   :    :OTHER,"INTERIOR OF BUILDING - NO RESPONSE, UNABLE TO VERIFY DETECTORS AND COMPLAINT OF RATS INFESTATION. AND TO VERIFY DETECTORS.",Arrange for inspection of premises. (13-12-100),BL00831,13645044,FAILED,N,COMPLAINT,CONSERVATION,6544 S WOLCOTT AVE,6544,S,WOLCOTT,AVE,381855,,41.774405296,-87.671510363,"(41.774405295559575, -87.67151036288253)",2022,01,14
6731876,01/14/2022,01/14/2022,CN190019,OPEN,,ARRANGE PREMISE INSPECTION,OTHER   :    :OTHER,5059W  /1ST FLOOR - NO RESPONSE. UNVERIFIED DETECTORS AND CONDITIONS. UNVERFIED OCCUPANCY.,Arrange for inspection of premises. (13-12-100),282126,13644910,FAILED,N,COMPLAINT,CONSERVATION,5059 W AGATITE AVE,5059,W,AGATITE,AVE,11365,,41.961435853,-87.754744639,"(41.96143585317444, -87.75474463862689)",2022,01,14
6732401,01/14/2022,01/14/2022,EV1110,OPEN,,MAINTAIN OR REPAIR ELECT ELEVA,,SERVICE FIRE EXTINGUISHER IN MACHINE ROOM AND MOUNT,"Failed to maintain electric elevator equipment provided at premises in safe and sound working condition. (13-196-590, 13-196-630(b), 18-30-001)",425425,13571564,FAILED,N,PERMIT,ELEVATOR,100 S LA SALLE ST,100,S,LA SALLE,ST,14796,,41.880611687,-87.632473574,"(41.88061168740763, -87.63247357435637)",2022,01,14
6731732,01/14/2022,01/14/2022,CN063024,OPEN,,CHIMNEY CAPPING,EXTERIOR:S   :,CHIMNEY - MISSING CAP,"Cap masonry chimney with non-combustible, water proof materials. (13-152-250 B, 13-152-240, 13-196-590)",BL00904,13644808,FAILED,N,COMPLAINT,CONSERVATION,922 N MONTICELLO AVE,922,N,MONTICELLO,AVE,52505,,41.897984178,-87.717764002,"(41.897984177824945, -87.71776400158289)",2022,01,14
6732397,01/14/2022,01/14/2022,EV1180,OPEN,,IDENTIFY ELEV POWER LINE DISC,,PROVIDE DISCONNECT SOURCE FEED LABEL FOR MAIN LINE,"Failed to identify elevator power supply line disconnection. (13-12-890, 13-20-120, 13-196-590, 18-27-620.51, 18-30-040, ASME A17.1-2007 2.29.1)",425425,13571564,FAILED,N,PERMIT,ELEVATOR,100 S LA SALLE ST,100,S,LA SALLE,ST,14796,,41.880611687,-87.632473574,"(41.88061168740763, -87.63247357435637)",2022,01,14
6731740,01/14/2022,01/14/2022,CN134016,OPEN,,RATS,EXTERIOR:N   :,GARAGE  - RAT INFESTATION,"Rid premises of rodents and seal rodent holes. (13-196-530 D, 13-196-540 A, 13-196-630 C)",BL00904,13644810,FAILED,N,COMPLAINT,CONSERVATION,4410 W MONROE ST,4410,W,MONROE,ST,250824,,41.8797486,-87.735948025,"(41.87974860003691, -87.73594802521563)",2022,01,14
6731911,01/13/2022,01/13/2022,CN132016,OPEN,,HEAT UNIT ADEQUATELY,"OTHER   :    :INTERIOR,","APT. 2A - BEDROOM TEMP 63F AT 3:40 P.M.HEATING SYSTEM IS OFF AT TIME OF INSPECTION, NO HEAT PROVIDED.APT. 3B - BEDROOM TEMP 62F AT 3:45 P.M.HEATING SYSTEM IS OFF AT TIME OF INSPECTION, NO HEAT PROVIDED.(14X-8-802.2, 14X-8-802.2.1 AND 14X-8-802.2.2)",Heat dwelling unit adequately from September 15th to June 1st. (13-196-410),365764,13644932,FAILED,N,COMPLAINT,CONSERVATION,1554 W JONQUIL TER,1554,W,JONQUIL,TER,24587,,42.021261678,-87.67049632,"(42.021261678150104, -87.67049631976245)",2022,01,13
6731810,07/14/2023,01/13/2022,CN064014,COMPLIED,07/14/2023,REPAIR CORNICE,OTHER   :    :OTHER,NORTH CORNICE - WASHED OUT MORTAR.,"Failed to maintain cornice in good repair and free from cracks and defects.  (13-196-530(e), 13-196-641)",87296,14114720,FAILED,N,COMPLAINT,CONSERVATION,403 W 103RD ST,403,W,103RD,ST,24594,,41.706930367,-87.633352654,"(41.70693036655445, -87.6333526539513)",2022,01,13
6731853,02/14/2022,01/13/2022,PL151137,COMPLIED,02/10/2022,OPEN,,,,400200,13644873,PASSED,N,PERMIT,PLUMBING,9012 S JEFFERY BLVD,9012,S,JEFFERY,BLVD,464283,,41.731151516,-87.575721699,"(41.731151516374666, -87.57572169886011)",2022,01,13
6732402,01/14/2022,01/14/2022,EV1110,OPEN,,MAINTAIN OR REPAIR ELECT ELEVA,,PROVIDE CODE DATA PLATE AND ETCH CODE YEAR IN AFFECT DURING ALTERATION,"Failed to maintain electric elevator equipment provided at premises in safe and sound working condition. (13-196-590, 13-196-630(b), 18-30-001)",425425,13571564,FAILED,N,PERMIT,ELEVATOR,100 S LA SALLE ST,100,S,LA SALLE,ST,14796,,41.880611687,-87.632473574,"(41.88061168740763, -87.63247357435637)",2022,01,14
6732392,01/14/2022,01/14/2022,EV1110,OPEN,,MAINTAIN OR REPAIR ELECT ELEVA,,PATCH ALL HOLES THROUGHOUT HOISTWAY WALLS,"Failed to maintain electric elevator equipment provided at premises in safe and sound working condition. (13-196-590, 13-196-630(b), 18-30-001)",425425,13571564,FAILED,N,PERMIT,ELEVATOR,100 S LA SALLE ST,100,S,LA SALLE,ST,14796,,41.880611687,-87.632473574,"(41.88061168740763, -87.63247357435637)",2022,01,14
6731968,01/13/2022,01/13/2022,CN073014,OPEN,,REPAIR EXTERIOR DOOR,OTHER   :    :OTHER,THE 1ST FLOOR APARTMENT REAR DOOR FRAME IS SPLINTERED FROM A BREAK IN. THIS DOOR DOES NOT PROPERLY LOCK AS A  RESULT OF THIS DAMAGE.SECTION 14X-3-303.13,"Failed to maintain exterior door in sound condition and repair.  (13-196-550(d) and (e), 13-196-641)",BL00685,13644968,FAILED,N,COMPLAINT,CONSERVATION,2315 N MEADE AVE,2315,N,MEADE,AVE,96071,,41.922458791,-87.777956814,"(41.92245879078645, -87.77795681447155)",2022,01,13
6732320,04/25/2023,01/14/2022,EV1110,COMPLIED,04/21/2023,MAINTAIN OR REPAIR ELECT ELEVA,,REPAIR ALARM BELL & INSTALL PIT BELL.,"Failed to maintain electric elevator equipment provided at premises in safe and sound working condition. (13-196-590, 13-196-630(b), 18-30-001)",312525,13645129,PASSED,N,PERMIT,ELEVATOR,500 S CLINTON ST,500,S,CLINTON,ST,14964,,41.875249232,-87.641126207,"(41.875249231595554, -87.64112620692853)",2022,01,14
