6728883,01/07/2022,01/07/2022,CN138106,OPEN,,STOP/REMOVE NUISANCE,EXTERIOR:E   :,REAR YARD - JUNK AND DEBRISWEST ELEVATION -1) MOUNDS OF DIRT WASHING ONTO NEIGHBOR PROPERTY OBSTRUCTING THE NEW FENCE INSTALLATION. 2)STORAGE SHED LEANING ONTO NEIGHBOR FENCE POST.,Remove and stop nuisance. (7-28-060),BL00904,13642428,FAILED,N,COMPLAINT,CONSERVATION,3306 W PIERCE AVE,3306,W,PIERCE,AVE,63726,,41.909267397,-87.709791014,"(41.90926739681558, -87.70979101383644)",2022,01,07
6728572,01/06/2022,01/06/2022,CN197019,OPEN,,INSTALL SMOKE DETECTORS,OTHER   :    :OTHER,"7801 / INTERIOR STAIRWAY AND APT 2N AND 1611 APT 1E / SMOKE DETECTORS - MISSING. CB197019 - SMOKE ALARMS / DETECTORS - INSTALL (14X-5-504.8, 14X-5-504.8.4,14B-9-907.2.10.1 THROUGH 14B-9-907.2.10.7, AND 14R-11-1104)","Install and maintain approved smoke detectors. (13-196-100 thru 13-196-160) Install a smoke detector in every dwelling unit. Install one on any living level with a habitable room or unenclosed heating plant, on the uppermost ceiling of enclosed porch stairwell, and within 15 feet of every sleeping room. Be sure the detector is at least 4 inches from the wall, 4 to 12 inches from the ceiling, and not above door or window.",371335,13642137,FAILED,N,COMPLAINT,CONSERVATION,7801 S MARSHFIELD AVE,7801,S,MARSHFIELD,AVE,424761,32.0,41.752070441,-87.664546674,"(41.75207044129094, -87.6645466742643)",2022,01,06
6728941,02/04/2022,01/07/2022,CN132016,COMPLIED,01/31/2022,HEAT UNIT ADEQUATELY,OTHER   :    :OTHER BL00876,"11017 APT 2 / ROOM TEMPERATURES : BEDROOM 60F AT 2:50 PM, LIVING ROOM 66F AT 2:50 PM. 11009 APT 2 / ROOM TEMPERTURES : BEDROOM 58F AT 3:10 PM, LIVING ROOM 67F AT 3:10 PM. HEATING SYSTEM IS ON, HEAT IS INSUFFICIENT. CB132016 - HEAT DWELLING UNIT ADEQUATELY (14X-8-802.2, 14X-8-802.2.1 AND14X-8-802.2.2)",Heat dwelling unit adequately from September 15th to June 1st. (13-196-410),371335,13642489,FAILED,N,COMPLAINT,CONSERVATION,11017 S VERNON AVE,11017,S,VERNON,AVE,510744,,41.694042179,-87.612046519,"(41.69404217904332, -87.61204651936008)",2022,01,07
6728969,01/07/2022,01/07/2022,CN132046,OPEN,,SAFE WORKING CONDITIONS,OTHER   :    :OTHER,CB132046 - 8657 S./- UNIT 3 - BOILER WAS OFF AT TIME OF INSPECTION ( PEOPLES ENERGY CUT GAS OFF DUE TO A GAS LEAK. PER TENANT.(14X-3-305.1: 14X-8-804.4 AND 14X-8-804.5).,"Provide and maintain every facility, piece of equipment, or utility in safe and sound working condition. (13-196-400, 13-196-440)",BL00831,13642525,FAILED,N,COMPLAINT,CONSERVATION,8657 S KOLIN AVE,8657,S,KOLIN,AVE,458691,,41.734784091,-87.729780403,"(41.734784090685835, -87.72978040305954)",2022,01,07
6728935,01/07/2022,01/07/2022,CN132016,OPEN,,HEAT UNIT ADEQUATELY,OTHER   :    :OTHER,"337 APT 3B / ROOM TEMPERATURES : BEDROOM 64F AT 2:15 PM, KITCHEN 65F AT 2:15 PM. HEATING SYSTEM IS ON, HEAT IS INSUFFICIENT. CB132016 - HEAT DWELLING UNIT ADEQUATELY (14X-8-802.2, 14X-8-802.2.1 AND14X-8-802.2.2)",Heat dwelling unit adequately from September 15th to June 1st. (13-196-410),371335,13642487,FAILED,N,COMPLAINT,CONSERVATION,837 E 86TH ST,837,E,86TH,ST,26611,51.0,41.738372106,-87.603425707,"(41.73837210600832, -87.60342570705699)",2022,01,07
6728613,01/06/2022,01/06/2022,CN197019,OPEN,,INSTALL SMOKE DETECTORS,INTERIOR:002 :,"5242 W WASHINGTON / 2ND FLOOR / MISSING SMOKE DETECTOR IN UNIT. 14X-5-504.8, 14X-5-504.8.4, 14B-9-907.2.10.1 THROUGH 14B-9-907.2.10.7, AND 14R-11-1104)","Install and maintain approved smoke detectors. (13-196-100 thru 13-196-160) Install a smoke detector in every dwelling unit. Install one on any living level with a habitable room or unenclosed heating plant, on the uppermost ceiling of enclosed porch stairwell, and within 15 feet of every sleeping room. Be sure the detector is at least 4 inches from the wall, 4 to 12 inches from the ceiling, and not above door or window.",447020,13642170,FAILED,N,COMPLAINT,CONSERVATION,5242 W WASHINGTON BLVD,5242,W,WASHINGTON,BLVD,34133,,41.882458924,-87.756787481,"(41.88245892447464, -87.75678748120198)",2022,01,06
6728696,03/08/2022,01/03/2022,EV1110,COMPLIED,03/04/2022,MAINTAIN OR REPAIR ELECT ELEVA,,ELEVATOR #2 CANTOR LEDGES IN THE HOISTWAY,"Failed to maintain electric elevator equipment provided at premises in safe and sound working condition. (13-196-590, 13-196-630(b), 18-30-001)",541663,13738856,PASSED,N,PERMIT,ELEVATOR,1210 N STATE PKWY,1210,N,STATE,PKWY,58223,,41.904256915,-87.628835717,"(41.904256914763096, -87.62883571744985)",2022,01,03
6728567,01/06/2022,01/06/2022,CN197087,OPEN,,CARB MONOX DETECT IN RESID,OTHER   :    :OTHER,"APT 2 / CARBON MONOXIDE DETECTORS - MISSING. CB197087 - CARBON MONOXIDE DETECTORS  / ALARM  IN DWELLING( 14X-5-504.9, 14B-9-915.1.1, 14B-9-915.2,AND 14R-11-1105 )","Install carbon monoxide detector within 40 feet of every sleeping room in residential structure. (13-64-190, 13-64-210) A carbon monoxide detector is needed whenever there is a heating appliance on the premises that burns fossil fuel such as gas, oil, or coal, or air that is circulated through a heat exchanger. Install according to manufacturer instructions. A hard wired model requires an electrical wiring permit. In a single family residence, be sure the detector is on or below the lowest floor with a place to sleep. In a multiple dwelling residence heated by a boiler, install a detector in the same room as the boiler. Otherwise, each apartment follows single family guidelines. The owner is responsible for installation and written instructions, the tenant for testing, maintenance, and batteries.",371335,13642135,FAILED,N,COMPLAINT,CONSERVATION,6914 S EGGLESTON AVE,6914,S,EGGLESTON,AVE,395584,,41.768484185,-87.636162824,"(41.76848418549438, -87.63616282429787)",2022,01,06
6728918,01/07/2022,01/07/2022,CN073014,OPEN,,REPAIR EXTERIOR DOOR,OTHER   :    :OTHER,EAST ELEVATION / FRONT EXIT DOOR - DOES NOT CLOSE.,"Failed to maintain exterior door in sound condition and repair.  (13-196-550(d) and (e), 13-196-641)",371335,13642473,FAILED,N,COMPLAINT,CONSERVATION,3722 S INDIANA AVE,3722,S,INDIANA,AVE,296602,,41.826725447,-87.621812197,"(41.826725446665186, -87.6218121965368)",2022,01,07
6728953,01/07/2022,01/07/2022,CN132016,OPEN,,HEAT UNIT ADEQUATELY,OTHER   :    :OTHER,"CB132016 - HEAT DWELLING UNIT ADEQUATELY (14X-8-802.2, 14X-8-802.2.1 AND 14X-8-802.2.2)6210 N./APT. #3B-ROOM TEMPERATURE-LIVING ROOM,66F., KITCHEN 66F., REAR BEDROOM 65 F AT 2:10 PM.THE RADIANT HEATING SYSTEM IS ON AT TIME OF INSPECTION,THE HEAT IS INSUFFICENT.",Heat dwelling unit adequately from September 15th to June 1st. (13-196-410),BL00708,13642512,FAILED,N,COMPLAINT,CONSERVATION,6210 N HOYNE AVE,6210,N,HOYNE,AVE,13002,43.0,41.994577922,-87.682551634,"(41.99457792226843, -87.68255163390106)",2022,01,07
6728725,01/07/2022,01/07/2022,CN197079,OPEN,,REPAIR/REPLACE SMOKE DETECTORS,OTHER   :    :OTHER,"CB197079 -1ST FLOOR, SMOKE DETECTOR FAILED TEST (14X-1;103.2.; 14ZX-1-103.3; 14X-5-504.1.1; 14X-5-504.10; 14A--3-314.1.4.)","Repair or replace defective or out of service smoke detectors and operate continuously. (13-196-130, 13-196-140)",BL00831,13642311,FAILED,N,COMPLAINT,CONSERVATION,7419 S PRINCETON AVE,7419,S,PRINCETON,AVE,408633,,41.759340836,-87.631924713,"(41.75934083585639, -87.63192471273693)",2022,01,07
6727606,03/30/2022,01/04/2022,CN101015,COMPLIED,02/28/2022,REPAIR INTERIOR WALLS/CEILING,INTERIOR:002 :2ND FLOOR BL00876,"5208 W HURON / 2ND FLOOR / 6"" X 12"" HOLE IN FRONT BEDROOM WALL FROM UNCOMPLETED DUCT WORK. DUCT WORK OPENINGS IN VARIOUS WALLS EXPOSED AND NOT COMPLETED.",Failed to maintain interior walls and ceilings free from holes or cracks.  (13-19-540(c)),447020,13641308,FAILED,N,COMPLAINT,CONSERVATION,5208 W HURON ST,5208,W,HURON,ST,43171,,41.893106078,-87.755958675,"(41.89310607758126, -87.75595867457562)",2022,01,04
6727607,03/30/2022,01/04/2022,CN197087,COMPLIED,02/28/2022,CARB MONOX DETECT IN RESID,INTERIOR:002 :2ND FLOOR BL00876,"5208 W HURON / 2ND FLOOR / MISSING CARBON MONOXIDE DETECTOR - FURNANCE ROOM (14X-5-504.9, 14B-9-915.1.1, 14B-9-915.2 AND 14R-11-1105)","Install carbon monoxide detector within 40 feet of every sleeping room in residential structure. (13-64-190, 13-64-210) A carbon monoxide detector is needed whenever there is a heating appliance on the premises that burns fossil fuel such as gas, oil, or coal, or air that is circulated through a heat exchanger. Install according to manufacturer instructions. A hard wired model requires an electrical wiring permit. In a single family residence, be sure the detector is on or below the lowest floor with a place to sleep. In a multiple dwelling residence heated by a boiler, install a detector in the same room as the boiler. Otherwise, each apartment follows single family guidelines. The owner is responsible for installation and written instructions, the tenant for testing, maintenance, and batteries.",447020,13641308,FAILED,N,COMPLAINT,CONSERVATION,5208 W HURON ST,5208,W,HURON,ST,43171,,41.893106078,-87.755958675,"(41.89310607758126, -87.75595867457562)",2022,01,04
6727609,03/30/2022,01/04/2022,CN073044,COMPLIED,02/28/2022,REPAIR EXTERIOR DOOR HARDWARE,EXTERIOR:S   :FRONT ENTRANCE BL00876,5208 W HURON / FRONT ENTRANCE / MISSING KNOB (DOOR HANDLE) HARDWARE.,"Failed to maintain exterior door hardware in good condition and repair.  (13-196-550(d), 13-196-641)",447020,13641308,FAILED,N,COMPLAINT,CONSERVATION,5208 W HURON ST,5208,W,HURON,ST,43171,,41.893106078,-87.755958675,"(41.89310607758126, -87.75595867457562)",2022,01,04
6727613,03/30/2022,01/04/2022,CN073044,COMPLIED,03/30/2022,REPAIR EXTERIOR DOOR HARDWARE,EXTERIOR:S   :FRONT ENTRANCE,5208 W HURON / FRONT ENTRANCE / MISSING KNOB (DOOR HANDLE) HARDWARE.,"Failed to maintain exterior door hardware in good condition and repair.  (13-196-550(d), 13-196-641)",BL00876,13641309,CLOSED,N,COMPLAINT,CONSERVATION,5208 W HURON ST,5208,W,HURON,ST,43171,,41.893106078,-87.755958675,"(41.89310607758126, -87.75595867457562)",2022,01,04
6728996,01/08/2022,01/08/2022,CN132016,OPEN,,HEAT UNIT ADEQUATELY,OTHER   :    :OTHER,"APT/ 3 AT 750 AM TEMP FRONT RM 64 AND REAR BED RM 64 . PER SECTION CODE  14X-8-802.2, 14X-8-802.2.1AND 14X-8-802.2.2) BHA CODES",Heat dwelling unit adequately from September 15th to June 1st. (13-196-410),87296,13642549,FAILED,N,COMPLAINT,CONSERVATION,254 E 121ST PL,254,E,121ST,PL,535240,,41.673676392,-87.615584931,"(41.673676391600964, -87.61558493141915)",2022,01,08
6729005,01/08/2022,01/08/2022,CN104075,OPEN,,WINDOW REPAIR FOR AIR SEEPAGE,OTHER   :    :OTHER,APT 1 /   AIR SEEPAGE - FRONT DOOR AND WINDOW . PER SECTION CODE 14X-3-303.13 AND 14X-12-1202.4.3.3),Failed to maintain windows in relation to the adjacent wall construction as to completely exclude rain and substantially exclude wind from entering the premises.  (13-196-550(f)),87296,13642558,FAILED,N,COMPLAINT,CONSERVATION,8212 S SOUTH SHORE DR,8212,S,SOUTH SHORE,DR,435241,,41.746091444,-87.548079925,"(41.746091443944344, -87.54807992529197)",2022,01,08
6729071,01/08/2022,01/08/2022,CN132016,OPEN,,HEAT UNIT ADEQUATELY,OTHER   :    :OTHER,"APT 101W/TEMP AT 442 PM FRONT RM 63 AND BED RM 65 DEGREES. PER SECTION CODE (14X-8-802.2, 14X-8-802.2.1AND 14X-8-802.2.2) BHA CODES",Heat dwelling unit adequately from September 15th to June 1st. (13-196-410),87296,13642619,FAILED,N,COMPLAINT,CONSERVATION,11127 S LANGLEY AVE,11127,S,LANGLEY,AVE,23389,,41.691970345,-87.605833952,"(41.69197034538082, -87.60583395201985)",2022,01,08
6729036,01/08/2022,01/08/2022,CN046013,OPEN,,UNAPPROVED HEATING DEVICE,OTHER   :    :OTHER,APT 103 / UNAPPROVE HEATING DEVICE - ELECT HEATER USED FOR HEAT . PER SECTION CODE . (14X-7-705.4 BHA CODES,Stop using cooking or water heating device as heating device. (13-196-400),87296,13642583,FAILED,N,COMPLAINT,CONSERVATION,72 E 59TH ST,72,E,59TH,ST,18998,,41.787520539,-87.622768133,"(41.78752053921138, -87.62276813254267)",2022,01,08
6729060,01/08/2022,01/08/2022,PL159017,OPEN,,REPLACE DEFECTIVE PLBG FIXTURE,OTHER   :    :OTHER,2ND FL/ BATH ROOM SINK / HOT HANDLE BROKEN .,"Repair or replace broken or defective plumbing fixture.  (18-29-102.3),  (18-29-402.1),  (18-29-402.1.1)",87296,13642617,FAILED,N,COMPLAINT,CONSERVATION,2407 E 105TH ST,2407,E,105TH,ST,501006,,41.704460337,-87.56535801,"(41.70446033730128, -87.5653580103843)",2022,01,08
6729037,01/08/2022,01/08/2022,CN132046,OPEN,,SAFE WORKING CONDITIONS,OTHER   :    :OTHER,"APT 103 / SAFE WORK CONDITIONS - BOILER NOT WORKING . PER SECTION CODE 14X-3-305.1, 14X-8-804.1, 14X-8-804.4 AND 14X-8-804.5) BHA CODES","Provide and maintain every facility, piece of equipment, or utility in safe and sound working condition. (13-196-400, 13-196-440)",87296,13642583,FAILED,N,COMPLAINT,CONSERVATION,72 E 59TH ST,72,E,59TH,ST,18998,,41.787520539,-87.622768133,"(41.78752053921138, -87.62276813254267)",2022,01,08
6729016,01/08/2022,01/08/2022,CN046013,OPEN,,UNAPPROVED HEATING DEVICE,OTHER   :    :OTHER,6547 / 1ST FLOOR APT. - USING STOVE AS HEATING DEVICE. ALSO HAS 3 ELECTRIC SPACE HEATERS FOR EXTRA HEAT. CB046013 - UNAPPOVED HEATING DEVICE (14X-8-802.2 AND CB132026 - PORTABLE ELECTRIC SPACE HEATERS (14X-7-705.4),Stop using cooking or water heating device as heating device. (13-196-400),371335,13642564,FAILED,N,COMPLAINT,CONSERVATION,6547 S NORMAL BLVD,6547,S,NORMAL,BLVD,379159,,41.774817715,-87.636717217,"(41.77481771468746, -87.6367172173732)",2022,01,08
6729027,01/08/2022,01/08/2022,CN131036,OPEN,,PROVID SELF CLSING SCREEN DVCE,OTHER   :    :OTHER,WEST ELEVATION / STORM DOOR - PANE MISSING,Provide self-closing device for screen door. (13-196-560 B),87296,13642572,FAILED,N,COMPLAINT,CONSERVATION,8128 S BURNHAM AVE,8128,S,BURNHAM,AVE,434590,,41.747344467,-87.556601511,"(41.74734446672557, -87.55660151067065)",2022,01,08
6729048,01/08/2022,01/08/2022,CN046013,OPEN,,UNAPPROVED HEATING DEVICE,OTHER   :    :OTHER,"APTS. 1C, 1D AND 2D / TENANTS ARE USING MULTIPLE ELECTRIC SPACE HEATERS. CB132026 - PORTABLE ELECTRIC SPACE HEATERS (14X-7-705.4)",Stop using cooking or water heating device as heating device. (13-196-400),371335,13642592,FAILED,N,COMPLAINT,CONSERVATION,10513 S HALE AVE,10513,S,HALE,AVE,505496,,41.702460194,-87.668957582,"(41.70246019425801, -87.66895758186563)",2022,01,08
6728990,01/07/2022,01/07/2022,B19101002,OPEN,,GATE - EGRESS,EXTERIOR:W   :AREA WAY,2621 S SPAULDING / AREA WAY / 2ND GATE - PAD LOCK ON GATE.,Comply with requirements for gates in means of egress. (14B-10-1010.2),447020,13642547,FAILED,N,COMPLAINT,CONSERVATION,2621 S SPAULDING AVE,2621,S,SPAULDING,AVE,286841,25.0,41.843828069,-87.707311379,"(41.84382806868999, -87.707311378775)",2022,01,07
6729000,01/08/2022,01/08/2022,CN104075,OPEN,,WINDOW REPAIR FOR AIR SEEPAGE,OTHER   :    :OTHER,APT 504 /WEST ELELATION / AIR SEEPAGE - WEST WINDOW .INTERIOR DOOR AIR GAPS AT BOTTOM DOOR . PER SECTION CODE 14X-3-303.13 AND 14X-12-1202.4.3.3),Failed to maintain windows in relation to the adjacent wall construction as to completely exclude rain and substantially exclude wind from entering the premises.  (13-196-550(f)),87296,13642552,FAILED,N,COMPLAINT,CONSERVATION,9510 S CONSTANCE AVE,9510,S,CONSTANCE,AVE,21538,,41.722058025,-87.579138717,"(41.72205802488057, -87.57913871678048)",2022,01,08
6729046,01/08/2022,01/08/2022,CN070024,OPEN,,REPAIR PORCH SYSTEM,OTHER   :    :OTHER,"SOUTH ELEVATION / WOOD PORCH DECK -  SAGGING IN CENTER. UNDERSIDE OF DECK IS COVERED WITH PLYWOOD AND LATTICE, UNABLE TO VERIFY CONDITION OF DECK STRUCTURE.","Failed to repair or replace defective or missing members of porch system.  (13-196-570, 13-196-641)",371335,13642590,FAILED,N,COMPLAINT,CONSERVATION,32 E 120TH ST,32,E,120TH,ST,535211,,41.67632924,-87.621341257,"(41.676329239998836, -87.62134125715164)",2022,01,08
6729061,01/08/2022,01/08/2022,EL0018,OPEN,,DEFECTIVE OUTLETS,OTHER   :    :OTHER,1ST AND 2ND FL / LIGHT SWITCH - BROKEN .OUTSIDE DOORBELL BROKEN,"Replace broken, inoperable, or painted over receptacle or switch. (18-27-200.1, 18-27-200.10(b))",87296,13642617,FAILED,N,COMPLAINT,CONSERVATION,2407 E 105TH ST,2407,E,105TH,ST,501006,,41.704460337,-87.56535801,"(41.70446033730128, -87.5653580103843)",2022,01,08
6729028,01/08/2022,01/08/2022,CN190019,OPEN,,ARRANGE PREMISE INSPECTION,OTHER   :    :OTHER,NO ENTRY TO INSP FOR CONDITIONS AND DETECTORS,Arrange for inspection of premises. (13-12-100),87296,13642572,FAILED,N,COMPLAINT,CONSERVATION,8128 S BURNHAM AVE,8128,S,BURNHAM,AVE,434590,,41.747344467,-87.556601511,"(41.74734446672557, -87.55660151067065)",2022,01,08
6729056,01/08/2022,01/08/2022,CN102015,OPEN,,INT WALL/CEILING PEELING PAINT,OTHER   :    :OTHER,1ST FL WEST WALL / INTERIOR WALL - LOOSE PAINT,"Failed to maintain interior walls, ceilings and woodwork free from flaking, peeling, chipped or loose paint.  (13-196-540(d))",87296,13642617,FAILED,N,COMPLAINT,CONSERVATION,2407 E 105TH ST,2407,E,105TH,ST,501006,,41.704460337,-87.56535801,"(41.70446033730128, -87.5653580103843)",2022,01,08
6729004,01/08/2022,01/08/2022,CN132046,OPEN,,SAFE WORKING CONDITIONS,OTHER   :    :OTHER,"APT 1 / ELECT  BASE HEATERS - OUT OF SERVICE . PERMIT REQUIRED FOR ELECT BASE BOARDS . KITCHEN ELECT BASE BOARD  HEATERS EXPOSE WIRES. WHEN SPACE  HEATERS TURN ON LIGHTS GET LOW .PER SECTION CODE (14X-3-305.1, 14X-8-804.1, 14X-8-804.4 AND 14X-8-804.5) BHA CODES","Provide and maintain every facility, piece of equipment, or utility in safe and sound working condition. (13-196-400, 13-196-440)",87296,13642558,FAILED,N,COMPLAINT,CONSERVATION,8212 S SOUTH SHORE DR,8212,S,SOUTH SHORE,DR,435241,,41.746091444,-87.548079925,"(41.746091443944344, -87.54807992529197)",2022,01,08
6729014,01/08/2022,01/08/2022,CN104075,OPEN,,WINDOW REPAIR FOR AIR SEEPAGE,OTHER   :    :OTHER,UNIT 15 / THROUGH WALL AC UNIT - DRAFTY WITH AIR SEEPAGE. CB104075 - WINDOW REPAIR FOR AIR SEEPAGE (14X-3-303.13 AND 14X-12-1202.4.3.3),Failed to maintain windows in relation to the adjacent wall construction as to completely exclude rain and substantially exclude wind from entering the premises.  (13-196-550(f)),371335,13642562,FAILED,N,COMPLAINT,CONSERVATION,6219 S ASHLAND AVE,6219,S,ASHLAND,AVE,19483,,41.780693093,-87.664102996,"(41.78069309303302, -87.66410299563707)",2022,01,08
6729070,01/08/2022,01/08/2022,CN197079,OPEN,,REPAIR/REPLACE SMOKE DETECTORS,OTHER   :    :OTHER,"APT 101W / REPAIR - SMOKE DETECTOR FROM  BEEPING . PER SECTION CODE 14.4.7.1. (14X-1-103.2, 14X-1-103.3, 14X-5-504.1.1, 14X-5-504.10 AND 14A-3-314.1.4) DETECTORS","Repair or replace defective or out of service smoke detectors and operate continuously. (13-196-130, 13-196-140)",87296,13642619,FAILED,N,COMPLAINT,CONSERVATION,11127 S LANGLEY AVE,11127,S,LANGLEY,AVE,23389,,41.691970345,-87.605833952,"(41.69197034538082, -87.60583395201985)",2022,01,08
6728991,01/07/2022,01/07/2022,CN139016,OPEN,,ABANDONED REFRIGERATOR,EXTERIOR:E   :AREA WAY,2621 S SPAULDING / AREA WAY / ABANDONED REFRIDERATOR BLOCKING AREA WAY TO ALLY,"Remove lid or door of abandoned refrigerator, ice box, or ice chest or remove from place accessible to children. (7-28-040)",447020,13642547,FAILED,N,COMPLAINT,CONSERVATION,2621 S SPAULDING AVE,2621,S,SPAULDING,AVE,286841,25.0,41.843828069,-87.707311379,"(41.84382806868999, -87.707311378775)",2022,01,07
6729057,01/08/2022,01/08/2022,CN101015,OPEN,,REPAIR INTERIOR WALLS/CEILING,OTHER   :    :OTHER,2ND FL CLOSET / WALL - WATER DAMAGE .,Failed to maintain interior walls and ceilings free from holes or cracks.  (13-19-540(c)),87296,13642617,FAILED,N,COMPLAINT,CONSERVATION,2407 E 105TH ST,2407,E,105TH,ST,501006,,41.704460337,-87.56535801,"(41.70446033730128, -87.5653580103843)",2022,01,08
6729024,01/08/2022,01/08/2022,CN077014,OPEN,,REPAIR FENCE,OTHER   :    :OTHER,WEST ELEVATION / NEWER IRON FENCE - 26X6 FT . PERMIT REQUIRED FOR REAR FENCE,"Failed to maintain fence in good condition and repair.  (7-28-060, 13-196-630, 13-196-641)",87296,13642572,FAILED,N,COMPLAINT,CONSERVATION,8128 S BURNHAM AVE,8128,S,BURNHAM,AVE,434590,,41.747344467,-87.556601511,"(41.74734446672557, -87.55660151067065)",2022,01,08
6729034,01/08/2022,01/08/2022,CN132016,OPEN,,HEAT UNIT ADEQUATELY,OTHER   :    :OTHER,"APT 103 / HEAT UNIT ADEQUALTEY - TEMP AT 120 PM  LIV RM 48 KITCHEN 47 .PER SECTION CODE (14X-8-802.2, 14X-8-802.2.1AND 14X-8-802.2.2) BHA CODES",Heat dwelling unit adequately from September 15th to June 1st. (13-196-410),87296,13642583,FAILED,N,COMPLAINT,CONSERVATION,72 E 59TH ST,72,E,59TH,ST,18998,,41.787520539,-87.622768133,"(41.78752053921138, -87.62276813254267)",2022,01,08
6729078,01/08/2022,01/08/2022,CN077014,OPEN,,REPAIR FENCE,EXTERIOR:N   :,REAR FENCES - NO PERMIT ON RECORD FOR FENCES. PERMIT REQUIRED,"Failed to maintain fence in good condition and repair.  (7-28-060, 13-196-630, 13-196-641)",BL00904,13642623,FAILED,N,COMPLAINT,CONSERVATION,1505 N MENARD AVE,1505,N,MENARD,AVE,68471,,41.907709075,-87.770554417,"(41.907709074800835, -87.77055441725979)",2022,01,08
6729043,01/08/2022,01/08/2022,CN138106,OPEN,,STOP/REMOVE NUISANCE,OTHER   :    :OTHER,REAR YARD - ABANADONED CAR.,Remove and stop nuisance. (7-28-060),371335,13642588,FAILED,N,COMPLAINT,CONSERVATION,28 E 120TH PL,28,E,120TH,PL,535181,,41.675414261,-87.621425155,"(41.67541426058276, -87.6214251547995)",2022,01,08
6729007,01/08/2022,01/08/2022,CN197039,OPEN,,RELOCATE SMOKE DETECTOR,OTHER   :    :OTHER,APT 1 / SMOKE DETECTOR - ON TOP OF REFG . PER SECTION CODE 14B-9-907.2.10.1 THRU 14B-9-907.2.10.4) DETECTORS,"Relocate improperly installed smoke detectors. (13-196-110) Install a smoke detector in every dwelling unit. Install one on any living level with a habitable room or unenclosed heating plant, on the uppermost ceiling of enclosed porch stairwell, and within 15 feet of every sleeping room. Be sure the detector is at least 4 inches from the wall, 4 to 12 inches from the ceiling, and not above door or window.",87296,13642558,FAILED,N,COMPLAINT,CONSERVATION,8212 S SOUTH SHORE DR,8212,S,SOUTH SHORE,DR,435241,,41.746091444,-87.548079925,"(41.746091443944344, -87.54807992529197)",2022,01,08
6729002,01/08/2022,01/08/2022,CN197087,OPEN,,CARB MONOX DETECT IN RESID,OTHER   :    :OTHER,"APT 1 / CARBON MONOXIDE - MISSING . PER SECTION CODE 14X-5-504.9, 14B-9-915.1.1, 14B-9-915.2 , AND 14R-11-1105)","Install carbon monoxide detector within 40 feet of every sleeping room in residential structure. (13-64-190, 13-64-210) A carbon monoxide detector is needed whenever there is a heating appliance on the premises that burns fossil fuel such as gas, oil, or coal, or air that is circulated through a heat exchanger. Install according to manufacturer instructions. A hard wired model requires an electrical wiring permit. In a single family residence, be sure the detector is on or below the lowest floor with a place to sleep. In a multiple dwelling residence heated by a boiler, install a detector in the same room as the boiler. Otherwise, each apartment follows single family guidelines. The owner is responsible for installation and written instructions, the tenant for testing, maintenance, and batteries.",87296,13642558,FAILED,N,COMPLAINT,CONSERVATION,8212 S SOUTH SHORE DR,8212,S,SOUTH SHORE,DR,435241,,41.746091444,-87.548079925,"(41.746091443944344, -87.54807992529197)",2022,01,08
6729068,01/08/2022,01/08/2022,CN046013,OPEN,,UNAPPROVED HEATING DEVICE,OTHER   :    :OTHER,APT 1W / UNAPPROVE HEATING DEVICE = ELECT HEATER USED FOR HEAT . PER SECTION CODE . (14X-7-705.4 BHA CODES,Stop using cooking or water heating device as heating device. (13-196-400),87296,13642619,FAILED,N,COMPLAINT,CONSERVATION,11127 S LANGLEY AVE,11127,S,LANGLEY,AVE,23389,,41.691970345,-87.605833952,"(41.69197034538082, -87.60583395201985)",2022,01,08
6728994,01/08/2022,01/08/2022,CN132046,OPEN,,SAFE WORKING CONDITIONS,OTHER   :    :OTHER,"APT 3 / SAFE WORK CONDITIONS - BOILER NOT WORKING . PER SECTION CODE (14X-3-305.1, 14X-8-804.1, 14X-8-804.4 AND 14X-8-804.5) BHA CODES","Provide and maintain every facility, piece of equipment, or utility in safe and sound working condition. (13-196-400, 13-196-440)",87296,13642549,FAILED,N,COMPLAINT,CONSERVATION,254 E 121ST PL,254,E,121ST,PL,535240,,41.673676392,-87.615584931,"(41.673676391600964, -87.61558493141915)",2022,01,08
6729058,01/08/2022,01/08/2022,CN103015,OPEN,,REPAIR FLOOR,OTHER   :    :OTHER,1ST FL KITCHEN / FLOOR - LEFTING UP,"Failed to maintain floor free from holes and wide cracks and free from loose, warped, protruding or rotting floor boards.  (13-196-540(a) and (b))",87296,13642617,FAILED,N,COMPLAINT,CONSERVATION,2407 E 105TH ST,2407,E,105TH,ST,501006,,41.704460337,-87.56535801,"(41.70446033730128, -87.5653580103843)",2022,01,08
6729025,01/08/2022,01/08/2022,CN074024,OPEN,,PROVIDE GUARD RAIL 42 IN HIGH,OTHER   :    :OTHER,WEST  ELEVATION / GUARD RAILS - AT GRADE MISSING,"Failed to provide porch which is more than two risers high with rails not less than three and one-half feet above the floor of the porch.  (13-196-570(b), 13-196-641",87296,13642572,FAILED,N,COMPLAINT,CONSERVATION,8128 S BURNHAM AVE,8128,S,BURNHAM,AVE,434590,,41.747344467,-87.556601511,"(41.74734446672557, -87.55660151067065)",2022,01,08
6729019,01/08/2022,01/08/2022,CN046013,OPEN,,UNAPPROVED HEATING DEVICE,OTHER   :    :OTHER,APT 209 AND 715 / UNAPPROVE DEVICE - 2 ELECT STOVE USED FOR HEAT APT 715 / ELECT SPACE HEATER USED FOR HEAT  PER SECTION CODE . (14X-7-705.4 BHA CODES,Stop using cooking or water heating device as heating device. (13-196-400),87296,13642566,FAILED,N,COMPLAINT,CONSERVATION,2355 E 67TH ST,2355,E,67TH,ST,20087,,41.773435792,-87.567783821,"(41.77343579173254, -87.5677838210307)",2022,01,08
6729006,01/08/2022,01/08/2022,CN046013,OPEN,,UNAPPROVED HEATING DEVICE,OTHER   :    :OTHER,APT 1/ ELECT SPACE HEATER - WITH  UNDER SIZED LARGE  ELECT CORDS.PER SECTION CODE . (14X-7-705.4 BHA,Stop using cooking or water heating device as heating device. (13-196-400),87296,13642558,FAILED,N,COMPLAINT,CONSERVATION,8212 S SOUTH SHORE DR,8212,S,SOUTH SHORE,DR,435241,,41.746091444,-87.548079925,"(41.746091443944344, -87.54807992529197)",2022,01,08
